{
  "title": "Lineage 2: The Chaotic Throne",
  "author": "sevenns",
  "verifiedAt": "2026-07-23",
  "tested": ["win32"],
  "preview": {
    "hero": [
      "assets/hero.jpg",
      "assets/wp2662643-chaotic-wallpaper-hd.jpg",
      "assets/wp4118296-lineage-2-wallpapers.jpg"
    ],
    "grid": "assets/grid.webp",
    "music": "assets/theme.mp3"
  }
}
