{
  "title": "Grand Theft Auto: Vice City – The Definitive Edition",
  "author": "sevenns",
  "verifiedAt": "2026-07-23",
  "tested": ["win32", "linux"],
  "preview": {
    "hero": ["assets/hero.jpg", "assets/1076235.png", "assets/1124247.png"],
    "grid": "assets/grid.webp",
    "music": "assets/theme.mp3"
  }
}
